"NO","ISSUE","SEVERITY","STANDARDS","FILES","OPTIONS"
"6","The App logs information. Sensitive information should never be logged.","info","CWE: CWE-532: Insertion of Sensitive Information into Log File                                               OWASP MASVS: MSTG-STORAGE-3","Show Files                                                                                                                                com/activeandroid/ActiveAndroid.java                                                                                                                                      com/activeandroid/Cache.java                                                                                                                                      com/activeandroid/Configuration.java                                                                                                                                      com/activeandroid/DatabaseHelper.java                                                                                                                                      com/activeandroid/Model.java                                                                                                                                      com/activeandroid/query/From.java                                                                                                                                      com/activeandroid/util/IOUtils.java                                                                                                                                      com/activeandroid/util/Log.java                                                                                                                                      com/activeandroid/util/ReflectionUtils.java                                                                                                                                      com/activeandroid/util/SQLiteUtils.java                                                                                                                                      com/brightcove/player/analytics/AnalyticsClient.java                                                                                                                                      com/brightcove/player/analytics/DefaultAnalyticsHandler.java                                                                                                                                      com/brightcove/player/edge/OfflineStoreManager.java                                                                                                                                      com/brightcove/player/logging/Log.java                                                                                                                                      com/brightcove/player/network/DownloadManager.java                                                                                                                                      com/brightcove/player/network/HttpService.java                                                                                                                                      com/brightcove/player/offline/MultiDataSource.java                                                                                                                                      com/brightcove/player/store/BaseStore.java                                                                                                                                      defpackage/b27.java                                                                                                                                      defpackage/bn2.java                                                                                                                                      defpackage/bq4.java                                                                                                                                      defpackage/cd6.java                                                                                                                                      defpackage/cw8.java                                                                                                                                      defpackage/d33.java                                                                                                                                      defpackage/d67.java                                                                                                                                      defpackage/de.java                                                                                                                                      defpackage/de8.java                                                                                                                                      defpackage/do9.java                                                                                                                                      defpackage/du3.java                                                                                                                                      defpackage/e02.java                                                                                                                                      defpackage/e67.java                                                                                                                                      defpackage/eo8.java                                                                                                                                      defpackage/eo9.java                                                                                                                                      defpackage/f02.java                                                                                                                                      defpackage/f23.java                                                                                                                                      defpackage/fe1.java                                                                                                                                      defpackage/ft9.java                                                                                                                                      defpackage/gh9.java                                                                                                                                      defpackage/gz8.java                                                                                                                                      defpackage/h23.java                                                                                                                                      defpackage/hv5.java                                                                                                                                      defpackage/io7.java                                                                                                                                      defpackage/j88.java                                                                                                                                      defpackage/jd0.java                                                                                                                                      defpackage/ld9.java                                                                                                                                      defpackage/lt8.java                                                                                                                                      defpackage/np8.java                                                                                                                                      defpackage/ow6.java                                                                                                                                      defpackage/p79.java                                                                                                                                      defpackage/pi1.java                                                                                                                                      defpackage/py3.java                                                                                                                                      defpackage/qg5.java                                                                                                                                      defpackage/qp2.java                                                                                                                                      defpackage/s44.java                                                                                                                                      defpackage/sv9.java                                                                                                                                      defpackage/t32.java                                                                                                                                      defpackage/tr8.java                                                                                                                                      defpackage/tu9.java                                                                                                                                      defpackage/v39.java                                                                                                                                      defpackage/vq9.java                                                                                                                                      defpackage/w39.java                                                                                                                                      defpackage/wr8.java                                                                                                                                      defpackage/wr9.java                                                                                                                                      defpackage/x29.java                                                                                                                                      defpackage/y39.java                                                                                                                                      defpackage/yv3.java                                                                                                                                      defpackage/zs9.java","Suppress the rule android_logging in com.gm.chevrolet.nomad.ownership                         Suppress the rule android_logging in com.gm.chevrolet.nomad.ownership only from these files"
"7","MD5 is a weak hash known to have hash collisions.","warning","CWE: CWE-327: Use of a Broken or Risky Cryptographic Algorithm                        OWASP Top 10: M5: Insufficient Cryptography                        OWASP MASVS: MSTG-CRYPTO-4","Show Files                                                                                                                                com/RNFetchBlob/RNFetchBlobReq.java                                                                                                                                      com/gm/tardis/core/notifications/TardisNotificationHandler.java                                                                                                                                      defpackage/gj.java                                                                                                                                      defpackage/he9.java                                                                                                                                      defpackage/m22.java                                                                                                                                      defpackage/qp2.java                                                                                                                                      defpackage/sh6.java","Suppress the rule android_md5 in com.gm.chevrolet.nomad.ownership                         Suppress the rule android_md5 in com.gm.chevrolet.nomad.ownership only from these files"
"8","SHA-1 is a weak hash known to have hash collisions.","warning","CWE: CWE-327: Use of a Broken or Risky Cryptographic Algorithm                        OWASP Top 10: M5: Insufficient Cryptography                        OWASP MASVS: MSTG-CRYPTO-4","Show Files                                                                                                                                defpackage/d33.java                                                                                                                                      defpackage/hf.java                                                                                                                                      defpackage/jd0.java                                                                                                                                      defpackage/nf8.java                                                                                                                                      defpackage/nm2.java                                                                                                                                      defpackage/sh6.java                                                                                                                                      defpackage/yx2.java","Suppress the rule android_sha1 in com.gm.chevrolet.nomad.ownership                         Suppress the rule android_sha1 in com.gm.chevrolet.nomad.ownership only from these files"
"9","App can read/write to External Storage. Any App can read data written to External Storage.","warning","CWE: CWE-276: Incorrect Default Permissions                        OWASP Top 10: M2: Insecure Data Storage                        OWASP MASVS: MSTG-STORAGE-2","Show Files                                                                                                                                com/RNFetchBlob/RNFetchBlob.java                                                                                                                                      com/brightcove/player/offline/ExternalFileCreator.java                                                                                                                                      com/brightcove/player/offline/MediaDownloadable.java                                                                                                                                      com/brightcove/player/util/FileUtil.java                                                                                                                                      com/gm/energyassistant/datamodels/JsonSaveFile.java                                                                                                                                      com/gm/energyassistant/datamodels/sharedStorage/LegacyDocumentFileProvider.java                                                                                                                                      com/gm/tardis/core/ownermanual/TardisOwnerManual.java                                                                                                                                      com/gm/vipkit/LogManager.java                                                                                                                                      com/learnium/RNDeviceInfo/RNDeviceModule.java                                                                                                                                      com/rnfs/RNFSManager.java                                                                                                                                      defpackage/cg5.java                                                                                                                                      defpackage/ih7.java                                                                                                                                      defpackage/iq6.java                                                                                                                                      defpackage/je.java                                                                                                                                      defpackage/ma1.java                                                                                                                                      defpackage/wn4.java                                                                                                                                      defpackage/wv.java","Suppress the rule android_read_write_external in com.gm.chevrolet.nomad.ownership                         Suppress the rule android_read_write_external in com.gm.chevrolet.nomad.ownership only from these files"
"10","IP Address disclosure","warning","CWE: CWE-200: Information Exposure                                               OWASP MASVS: MSTG-CODE-2","com/nimbusds/jose/jwk/Curve.java                                                                                                                            defpackage/dz1.java","Suppress the rule android_ip_disclosure in com.gm.chevrolet.nomad.ownership                         Suppress the rule android_ip_disclosure in com.gm.chevrolet.nomad.ownership only from these files"
"11","This App uses SSL certificate pinning to detect or  prevent MITM attacks in secure communication channel.","secure","OWASP MASVS: MSTG-NETWORK-4","Show Files                                                                                                                                com/here/network/NetworkSSLContextFactory.java                                                                                                                                      defpackage/bd4.java                                                                                                                                      defpackage/bq4.java                                                                                                                                      defpackage/hj6.java                                                                                                                                      defpackage/lb0.java                                                                                                                                      defpackage/lv1.java                                                                                                                                      defpackage/su0.java","Suppress the rule android_ssl_pinning in com.gm.chevrolet.nomad.ownership                         Suppress the rule android_ssl_pinning in com.gm.chevrolet.nomad.ownership only from these files"
"12","This App may have root detection capabilities.","secure","OWASP MASVS: MSTG-RESILIENCE-1","Show Files                                                                                                                                defpackage/ft9.java                                                                                                                                      defpackage/gx5.java                                                                                                                                      defpackage/he.java                                                                                                                                      defpackage/uo7.java                                                                                                                                      defpackage/v39.java","Suppress the rule android_detect_root in com.gm.chevrolet.nomad.ownership                         Suppress the rule android_detect_root in com.gm.chevrolet.nomad.ownership only from these files"
"13","Insecure WebView Implementation. Execution of user controlled code in WebView is a critical Security Hole.","warning","CWE: CWE-749: Exposed Dangerous Method or Function                        OWASP Top 10: M1: Improper Platform Usage                        OWASP MASVS: MSTG-PLATFORM-7","Show Files                                                                                                                                com/gm/energyassistant/JsBridgeWebView.java                                                                                                                                      com/gm/energyassistant/projection/ProjectionWebView.java                                                                                                                                      com/gm/gemini/auto/plugins/auto_gml_mini_app/AutoGmlMiniAppView.java                                                                                                                                      com/gm/gemini/plugin_common_resources/fragment/MsalPapiWebViewFragment.java","Suppress the rule android_webview in com.gm.chevrolet.nomad.ownership                         Suppress the rule android_webview in com.gm.chevrolet.nomad.ownership only from these files"
"14","The App uses the encryption mode CBC with PKCS5/PKCS7 padding. This configuration is vulnerable to padding oracle attacks.","high","CWE: CWE-649: Reliance on Obfuscation or Encryption of Security-Relevant Inputs without Integrity Checking                        OWASP Top 10: M5: Insufficient Cryptography                        OWASP MASVS: MSTG-CRYPTO-3","Show Files                                                                                                                                com/gm/tardis/core/security/Encryption.java                                                                                                                                      com/nimbusds/jose/crypto/impl/AESCBC.java                                                                                                                                      com/nimbusds/jose/jca/JCASupport.java                                                                                                                                      defpackage/b8.java","Suppress the rule cbc_padding_oracle in com.gm.chevrolet.nomad.ownership                         Suppress the rule cbc_padding_oracle in com.gm.chevrolet.nomad.ownership only from these files"
"15","This App copies data to clipboard. Sensitive data should not be copied to clipboard as other applications can access it.","info","OWASP MASVS: MSTG-STORAGE-10","com/gm/gemini/tardis/HybridCommunicator.java                                                                                                                            defpackage/df1.java                                                                                                                            defpackage/p11.java","Suppress the rule android_clipboard_copy in com.gm.chevrolet.nomad.ownership                         Suppress the rule android_clipboard_copy in com.gm.chevrolet.nomad.ownership only from these files"
"16","The file or SharedPreference is World Writable. Any App can write to the file","high","CWE: CWE-276: Incorrect Default Permissions                        OWASP Top 10: M2: Insecure Data Storage                        OWASP MASVS: MSTG-STORAGE-2","defpackage/u31.java","Suppress the rule android_world_writable in com.gm.chevrolet.nomad.ownership                         Suppress the rule android_world_writable in com.gm.chevrolet.nomad.ownership only from these files"
"17","Ensure that user controlled URLs never reaches the Webview. Enabling file access from URLs in WebView can leak sensitive information from the file system.","warning","CWE: CWE-200: Information Exposure                        OWASP Top 10: M1: Improper Platform Usage                        OWASP MASVS: MSTG-PLATFORM-7","com/gm/gemini/auto/plugins/auto_gml_mini_app/AutoGmlMiniAppView.java","Suppress the rule android_webview_allow_file_from_url in com.gm.chevrolet.nomad.ownership                         Suppress the rule android_webview_allow_file_from_url in com.gm.chevrolet.nomad.ownership only from these files"
"18","Remote WebView debugging is enabled.","high","CWE: CWE-919: Weaknesses in Mobile Applications                        OWASP Top 10: M1: Improper Platform Usage                        OWASP MASVS: MSTG-RESILIENCE-2","com/gm/gemini/auto/plugins/auto_gml_mini_app/AutoGmlMiniAppView.java","Suppress the rule android_webview_debug in com.gm.chevrolet.nomad.ownership                         Suppress the rule android_webview_debug in com.gm.chevrolet.nomad.ownership only from these files"