"PERMISSION","STATUS","INFO","DESCRIPTION","CODE MAPPINGS"
"android.permission.RECEIVE_BOOT_COMPLETED","normal","automatically start at boot","Allows an application to start itself as soon as the system has finished booting. This can make it take longer to start the phone and allow the application to slow down the overall phone by always running.","Show Files                                                                                                                                                                                                                                                                                                                                                                                                                                                                                                                                                                                                                                                                                                                                                    com/adobe/mobile/MessageNotificationHandler.java                                                                                                                                                                                                    com/adobe/mobile/MobileConfig.java                                                                                                                                                                                                    com/adobe/mobile/ReferralReceiver.java                                                                                                                                                                                                    com/aqsmartphone/android/nissan/Charge/ChargingActivity.java                                                                                                                                                                                                    com/aqsmartphone/android/nissan/HomeScreen/HomeScreenFragmentNew.java                                                                                                                                                                                                    com/aqsmartphone/android/nissan/SendToCar.java                                                                                                                                                                                                    com/aqsmartphone/android/nissan/SendToCarNew.java                                                                                                                                                                                                    com/bumptech/glide/manager/DefaultConnectivityMonitor.java                                                                                                                                                                                                    com/criticalblue/approovsdk/c.java"
"android.permission.SET_TIME_ZONE","SignatureOrSystem","set time zone","Allows an application to change the phone's time zone.",""
"android.permission.USE_FINGERPRINT","normal","allow use of fingerprint","This constant was deprecated in API level 28. Applications should request USE_BIOMETRIC instead.","Show Files                                                                                                                                                                                                                                                                                                                                                                                                                                                                                                                                                                                                                                                                                                                                                                                                                        com/aqsmartphone/android/nissan/FingerprintHandler.java                                                                                                                                                                                                    com/aqsmartphone/android/nissan/Settings/SettingsActivity.java                                                                                                                                                                                                    com/aqsmartphone/android/nissan/UserSegmentation/LoginActivity.java                                                                                                                                                                                                    com/aqsmartphone/android/nissan/Utilities/AppUtils.java"
"android.permission.WAKE_LOCK","normal","prevent phone from sleeping","Allows an application to prevent the phone from going to sleep.","Show Files                                                                                                                                                                                                                                                                                                                                                                                                                                                                    com/aqsmartphone/android/nissan/Charge/ChargingActivity.java                                                                                                                                                                                                    com/aqsmartphone/android/nissan/Climate/ClimateFragmentNew.java                                                                                                                                                                                                    com/aqsmartphone/android/nissan/HomeScreen/HomeScreenActivity.java                                                                                                                                                                                                    com/aqsmartphone/android/nissan/HomeScreen/HomeScreenFragmentNew.java                                                                                                                                                                                                    com/aqsmartphone/android/nissan/MapsAndNavigation/VehicleLocatorFragment.java                                                                                                                                                                                                    com/aqsmartphone/android/nissan/NissanLeafApplication.java                                                                                                                                                                                                    com/aqsmartphone/android/nissan/RangeInsight/RangeInsight.java                                                                                                                                                                                                    com/aqsmartphone/android/nissan/SendToCar.java                                                                                                                                                                                                    com/aqsmartphone/android/nissan/SendToCarNew.java                                                                                                                                                                                                    com/aqsmartphone/android/nissan/Settings/BoundaryAlertMapFragment.java                                                                                                                                                                                                    com/aqsmartphone/android/nissan/SplashScreen/SplashScreenActivity.java                                                                                                                                                                                                    com/aqsmartphone/android/nissan/Utilities/WearableServicePhone.java                                                                                                                                                                                                    com/aqsmartphone/android/nissan/widgetUtils/WidgetUtlis.java                                                                                                                                                                                                    net/sqlcipher/database/SQLiteDatabase.java"
"android.permission.WRITE_EXTERNAL_STORAGE","dangerous","read/modify/delete external storage contents","Allows an application to write to external storage.","Show Files                                                                                                                                                                                                                                                        com/adobe/mobile/RemoteDownload.java                                                                                                                                                                                                    com/adobe/mobile/WearableDataResponse.java                                                                                                                                                                                                    com/aqsmartphone/android/nissan/UserSegmentation/VINErrorFragment.java                                                                                                                                                                                                    com/aqsmartphone/android/nissan/Utilities/FileUtil.java                                                                                                                                                                                                    com/bumptech/glide/disklrucache/DiskLruCache.java                                                                                                                                                                                                    com/bumptech/glide/load/model/StreamEncoder.java                                                                                                                                                                                                    com/bumptech/glide/load/resource/bitmap/BitmapEncoder.java                                                                                                                                                                                                    com/github/mikephil/charting/charts/Chart.java                                                                                                                                                                                                    javax/xml/bind/helpers/AbstractMarshallerImpl.java                                                                                                                                                                                                    net/sqlcipher/database/SQLiteDatabase.java                                                                                                                                                                                                    nissanleaf/cts/com/nissanlibrary/Connectivity/FilePath.java                                                                                                                                                                                                    nissanleaf/cts/com/nissanlibrary/Connectivity/Utility/FiileUtilsfromURI.java                                                                                                                                                                                                    okio/Okio__JvmOkioKt.java"
"com.aqsmartphone.android.nissan.DYNAMIC_RECEIVER_NOT_EXPORTED_PERMISSION","unknown","Unknown permission","Unknown permission from android reference",""
"com.google.android.c2dm.permission.RECEIVE","normal","recieve push notifications","Allows an application to receive push notifications from cloud.","Show Files                                                                                                                                                                                                                                                                                                                                                                                                                                                                                                                                                                                                                                                                                                                                                                                                                                                                                                                                                                                                                                    com/aqsmartphone/android/nissan/Utilities/WearableServicePhone.java"
"com.google.android.finsky.permission.BIND_GET_INSTALL_REFERRER_SERVICE","normal","permission defined by google","A custom permission defined by Google.",""
"com.google.android.providers.gsf.permission.READ_GSERVICES","unknown","Unknown permission","Unknown permission from android reference",""